{"$id":"hepta.servo.source_acceptance_review_policy.v1","$schema":"https://json-schema.org/draft/2020-12/schema","additionalProperties":false,"properties":{"allowed_auxiliary_paths":{"items":{"type":"string"},"minItems":1,"type":"array","uniqueItems":true},"authority":{"additionalProperties":false,"properties":{"credential_export_allowed":{"const":false},"effect_authority":{"const":false},"execute_allowed":{"const":false},"external_effect":{"const":false},"external_network_allowed":{"const":false},"g5_allowed":{"const":false},"machine_authority":{"const":false},"operator_acceptance":{"const":false},"production_caller":{"const":false},"production_writer":{"const":false},"promotion":{"const":false},"release_qualified":{"const":false},"runtime_authority":{"const":false}},"required":["machine_authority","runtime_authority","production_caller","production_writer","effect_authority","external_effect","external_network_allowed","credential_export_allowed","operator_acceptance","g5_allowed","execute_allowed","promotion","release_qualified"],"type":"object"},"base_branch":{"const":"integration/vnext-main-20260811"},"candidate_snapshot_prefix":{"const":"docs/hepta-vnext/browser/source-acceptance/candidates/"},"challenge_snapshot_prefix":{"const":"docs/hepta-vnext/browser/source-acceptance/challenges/"},"claims_after_acceptance":{"additionalProperties":false,"properties":{"build_authorized":{"const":false},"build_recipe_accepted":{"const":false},"exact_servo_source_accepted":{"const":true},"operator_acceptance":{"const":false},"promotion":{"const":false},"release_qualified":{"const":false},"servo_built":{"const":false},"servo_runtime_qualified":{"const":false},"source_review_candidate_accepted":{"const":true},"worker_artifact_created":{"const":false},"worker_source_topology_accepted":{"const":false}},"required":["exact_servo_source_accepted","source_review_candidate_accepted","worker_source_topology_accepted","build_recipe_accepted","build_authorized","servo_built","worker_artifact_created","servo_runtime_qualified","operator_acceptance","promotion","release_qualified"],"type":"object"},"phase":{"const":"DEVELOPMENT"},"pointer_path":{"const":"docs/hepta-vnext/browser/source-acceptance/ACCEPTED_SOURCE_POINTER.json"},"policy_id":{"pattern":"^hepta-servo-source-acceptance-review-policy:v1:[0-9a-f]{64}$","type":"string"},"repository":{"const":"ProfAlexQI/hepta-private-ci"},"review":{"additionalProperties":false,"properties":{"allowed_author_associations":{"const":["COLLABORATOR","MEMBER","OWNER"]},"codeowner_review_required":{"const":false},"draft_allowed":{"const":false},"head_ref_prefix":{"const":"review/hepta-servo-source-acceptance-"},"minimum_approvals":{"minimum":1,"type":"integer"},"pointer_must_bind_head_ref":{"const":true},"pointer_must_bind_pull_request_number":{"const":true},"reject_changes_requested":{"const":true},"require_current_head_commit":{"const":true},"required_body_prefix":{"const":"HEPTA_SOURCE_ACCEPT_V1 "},"required_status_check":{"const":"Source-only accepted pointer live review"},"reviewer_must_differ_from_pr_author":{"const":true}},"required":["minimum_approvals","reviewer_must_differ_from_pr_author","require_current_head_commit","reject_changes_requested","allowed_author_associations","required_body_prefix","head_ref_prefix","draft_allowed","codeowner_review_required","pointer_must_bind_pull_request_number","pointer_must_bind_head_ref","required_status_check"],"type":"object"},"schema":{"const":"hepta.servo.source_acceptance_review_policy.v1"},"schema_version":{"const":1}},"required":["schema","schema_version","phase","repository","base_branch","pointer_path","candidate_snapshot_prefix","challenge_snapshot_prefix","allowed_auxiliary_paths","review","claims_after_acceptance","authority","policy_id"],"title":"Hepta Servo source acceptance review policy","type":"object"}