{"allowed_auxiliary_paths":["docs/hepta-vnext/browser/C1_CURRENT_V6.json","docs/hepta-vnext/browser/C1_EXACT_SOURCE_ACCEPTANCE_POINTER_V1_STATUS.json","docs/hepta-vnext/browser/CURRENT.yaml","docs/hepta-vnext/browser/README.md"],"authority":{"credential_export_allowed":false,"effect_authority":false,"execute_allowed":false,"external_effect":false,"external_network_allowed":false,"g5_allowed":false,"machine_authority":false,"operator_acceptance":false,"production_caller":false,"production_writer":false,"promotion":false,"release_qualified":false,"runtime_authority":false},"base_branch":"integration/vnext-main-20260811","candidate_snapshot_prefix":"docs/hepta-vnext/browser/source-acceptance/candidates/","challenge_snapshot_prefix":"docs/hepta-vnext/browser/source-acceptance/challenges/","claims_after_acceptance":{"build_authorized":false,"build_recipe_accepted":false,"exact_servo_source_accepted":true,"operator_acceptance":false,"promotion":false,"release_qualified":false,"servo_built":false,"servo_runtime_qualified":false,"source_review_candidate_accepted":true,"worker_artifact_created":false,"worker_source_topology_accepted":false},"phase":"DEVELOPMENT","pointer_path":"docs/hepta-vnext/browser/source-acceptance/ACCEPTED_SOURCE_POINTER.json","policy_id":"hepta-servo-source-acceptance-review-policy:v1:f998e2cb6ee597115f9c6c052ce2b3b76e59df3e7b5a22ea177fb4c24260b18a","repository":"ProfAlexQI/hepta-private-ci","review":{"allowed_author_associations":["COLLABORATOR","MEMBER","OWNER"],"codeowner_review_required":false,"draft_allowed":false,"head_ref_prefix":"review/hepta-servo-source-acceptance-","minimum_approvals":1,"pointer_must_bind_head_ref":true,"pointer_must_bind_pull_request_number":true,"reject_changes_requested":true,"require_current_head_commit":true,"required_body_prefix":"HEPTA_SOURCE_ACCEPT_V1 ","required_status_check":"Source-only accepted pointer live review","reviewer_must_differ_from_pr_author":true},"schema":"hepta.servo.source_acceptance_review_policy.v1","schema_version":1}